{
  "schemaVersion": "0.1.0",
  "runId": "example-2026-05-16-001",
  "createdAt": "2026-05-16T10:00:00Z",
  "privacy": {
    "rawMeetingContentIncluded": false,
    "tokensIncluded": false,
    "redactionLevel": "summary-only"
  },
  "task": {
    "title": "PI + Hermes meeting agent design review",
    "requestedOutputs": [
      "meeting-minutes",
      "prd",
      "tech-architecture"
    ]
  },
  "inputs": [
    {
      "kind": "meeting-summary",
      "source": "local redacted transcript summary",
      "privacy": "private"
    },
    {
      "kind": "platform-context",
      "source": "Feishu metadata only",
      "privacy": "internal"
    }
  ],
  "outputs": [
    {
      "kind": "meeting-minutes",
      "status": "drafted",
      "qualityNotes": "Structure matches golden meeting minutes style."
    },
    {
      "kind": "tech-architecture",
      "status": "drafted",
      "qualityNotes": "Execution and learning planes separated."
    }
  ],
  "decisions": [
    {
      "decision": "PI is the active execution kernel.",
      "reason": "PI package model keeps integrations lego-like through skills and extensions.",
      "evidence": "architecture decision record"
    },
    {
      "decision": "Hermes is a learning sidecar.",
      "reason": "Avoids exposing Feishu/Rokid credentials while preserving retrospective optimization.",
      "evidence": "security decision record"
    }
  ],
  "qualitySignals": {
    "evidenceCoverage": 0.82,
    "privacyFindings": [],
    "missingInputs": [
      "final Rokid Lingzhu MCP capability names",
      "Feishu CLI authentication profile"
    ],
    "runSummary": "Generated meeting and architecture drafts from redacted evidence. Feishu CLI was treated as an external execution capability, not as a custom audited action list."
  }
}
